{
  "uuid": "a1b2c3d4-e5f6-7890-abcd-ef1234567890",
  "timestamp": "2025-03-15T14:30:00Z",
  "used_version": 59,
  "vault_uuid": "a1b2c3d4-e5f6-7890-abcd-ef1234567890",
  "item_uuid": "a1b2c3d4-e5f6-7890-abcd-ef1234567890",
  "action": "secure-copy",
  "user": "example-value",
  "client": "example-value",
  "location": "example-value"
}